MCQ,Choices,Correct
Who coined the term 'machine learning' in 1959?,a: Donald Hebb | b: Tom M. Mitchell | c: Arthur Samuel | d: Walter Pitts,c
What was the name of the experimental 'learning machine' developed by Raytheon Company in the early 1960s?,a: Cybertron | b: Deep Blue | c: HAL 9000 | d: Skynet,a
Who proposed the early mathematical models of neural networks for machine learning algorithms?,a: Donald Hebb | b: Warren McCulloch | c: Tom M. Mitchell | d: Arthur Samuel,b
What is the main objective of modern-day machine learning?,a: To confuse data | b: To make predictions based on models | c: To hide data | d: To ignore data,b
"According to Tom M. Mitchell, when does a computer program learn from experience?",a: When it stops working | b: When its performance improves with experience | c: When it forgets everything | d: When it never learns,b
